{
  "schema": "dumbmoney.model-gateway-runner-config.v1",
  "data_root": "C:\\ProgramData\\DumbMoney\\model-gateway",
  "readiness_path": "C:\\ProgramData\\DumbMoney\\readiness\\DumbMoneyModelGateway.json",
  "gateway_public_key_path": "C:\\ProgramData\\DumbMoney\\model-gateway\\keys\\gateway-ed25519.pub",
  "fund_lock_path": "C:\\Program Files\\DumbMoney\\releases\\TO_BE_RESOLVED\\fund.lock.json",
  "service_manifest_path": "C:\\Program Files\\DumbMoney\\releases\\TO_BE_RESOLVED\\services.v1.json",
  "bind_port": 8788,
  "release_id": "TO_BE_RESOLVED",
  "fund_lock_sha256": "0000000000000000000000000000000000000000000000000000000000000000",
  "service_manifest_sha256": "0000000000000000000000000000000000000000000000000000000000000000",
  "gateway_public_key_sha256": "0000000000000000000000000000000000000000000000000000000000000000",
  "readiness_ttl_seconds": 90,
  "request_body_max_bytes": 262144,
  "max_active_requests": 4,
  "client_socket_timeout_seconds": 10,
  "request_timeout_seconds": 15,
  "attestation_max_age_seconds": 15,
  "near_midnight_fence_seconds": 300,
  "max_prompt_characters": 100000,
  "max_response_bytes": 1000000,
  "expected_key_label": "TO_BE_RESOLVED",
  "credential_targets": {
    "openrouter_api_key": "credential-target:DumbMoney/OpenRouterApiKey",
    "gateway_signing_seed": "credential-target:DumbMoney/ModelGatewaySigner",
    "client_bearer_token": "credential-target:DumbMoney/ModelGatewayClientToken"
  },
  "routes": {
    "research": {
      "model": "TO_BE_RESOLVED/model",
      "provider": "TO_BE_RESOLVED",
      "provider_name": "TO_BE_RESOLVED",
      "max_output_tokens": 1024,
      "max_price": {
        "prompt": 0,
        "completion": 0
      }
    },
    "evaluation": {
      "model": "TO_BE_RESOLVED/model",
      "provider": "TO_BE_RESOLVED",
      "provider_name": "TO_BE_RESOLVED",
      "max_output_tokens": 1024,
      "max_price": {
        "prompt": 0,
        "completion": 0
      }
    },
    "operations": {
      "model": "TO_BE_RESOLVED/model",
      "provider": "TO_BE_RESOLVED",
      "provider_name": "TO_BE_RESOLVED",
      "max_output_tokens": 1024,
      "max_price": {
        "prompt": 0,
        "completion": 0
      }
    }
  }
}
